{
  "schemaVersion": 1,
  "evidenceType": "play-pre-launch-report",
  "captureMethod": "play-console",
  "packageName": "com.personal.alarmpyo",
  "versionName": "1.24",
  "versionCode": 24,
  "aabSha256": "aaaaaaaaaaaaaaaaaaaaaaaaaaaaaaaaaaaaaaaaaaaaaaaaaaaaaaaaaaaaaaaa",
  "sourceCommit": "bbbbbbbbbbbbbbbbbbbbbbbbbbbbbbbbbbbbbbbb",
  "easBuildId": "11111111-1111-4111-8111-111111111111",
  "completedAt": "2026-08-24T11:00:00.000Z",
  "status": "completed",
  "categories": {
    "stability": { "blockingIssueCount": 0 },
    "compatibility": { "blockingIssueCount": 0 },
    "performance": { "blockingIssueCount": 0 },
    "accessibility": { "blockingIssueCount": 0 }
  }
}
